Text,Category
0,The stock market experienced significant volatility today.,Financial
1,Investors are optimistic about the company's quarterly earnings.,Financial
2,The central bank announced a new interest rate cut.,Financial
3,Cryptocurrency prices surged after regulatory approval.,Financial
4,The bond market remains stable despite economic uncertainty.,Financial
5,Forex trading volumes hit a new high this month.,Financial
6,The company announced a major merger with its competitor.,Financial
7,Inflation rates are expected to rise in the coming months.,Financial
8,The real estate market is showing signs of cooling down.,Financial
9,Tech stocks led the rally on Wall Street today.,Financial
10,The government introduced new tax incentives for small businesses.,Financial
11,Oil prices dropped due to oversupply concerns.,Financial
12,The unemployment rate fell to its lowest level in a decade.,Financial
13,The company issued a profit warning for the next quarter.,Financial
14,Consumer spending increased during the holiday season.,Financial
15,The trade deficit widened unexpectedly last month.,Financial
16,Gold prices hit a record high amid global uncertainty.,Financial
17,The bank reported a significant increase in net income.,Financial
18,The Federal Reserve signaled a potential rate hike next year.,Financial
19,"The IPO was oversubscribed, indicating strong investor interest.",Financial
20,The housing market is experiencing a boom in suburban areas.,Financial
21,The company launched a new financial product for millennials.,Financial
22,Credit card debt levels are rising among young adults.,Financial
23,The stock buyback program boosted the company's share price.,Financial
24,"The economic recovery is gaining momentum, analysts say.",Financial
25,The fiscal policy changes will impact corporate tax rates.
26,The company declared bankruptcy after failing to secure funding.,Financial
27,The trade war between the two countries escalated today.,Financial
28,The finance minister announced a new budget plan.,Financial
29,The currency devaluation has affected import prices significantly.,Financial
30,The tech startup secured a substantial investment from venture capitalists.,Financial
31,The interest rates on savings accounts have been lowered.,Financial
32,The financial crisis led to a wave of bank failures.,Financial
33,The GDP growth rate exceeded economists' expectations.,Financial
34,The central bank is considering implementing negative interest rates.,Financial
35,The retail sector is facing challenges due to online competition.,Financial
36,The company is expanding its operations into international markets.,Financial
37,The hedge fund manager predicted a market downturn.,Financial
38,The financial services industry is undergoing digital transformation.,Financial
39,The new regulations aim to increase transparency in financial transactions.,Financial
40,The company's dividend payout was higher than expected.,Financial
41,The audit revealed discrepancies in the financial statements.,Financial
42,The pension fund's performance was above the benchmark.,Financial
43,The government bonds are considered a safe investment.,Financial
44,The insurance company introduced new policies for natural disasters.,Financial
45,The corporate bond market is experiencing increased activity.,Financial
46,The currency exchange rates are influenced by geopolitical events.,Financial
47,The financial analyst provided a positive outlook for the sector.,Financial
48,The company adopted a new strategy to improve profitability.,Financial
49,I booked my flight ticket to Paris online.,Travel
50,The train ticket to New York was surprisingly affordable.,
51,We need to get our bus tickets early to avoid the rush.,Travel
52,My ticket for the concert was emailed to me.,Travel
53,Do you have the tickets for our movie night?,Travel
54,She lost her plane ticket at the airport.,Travel
55,We bought our cruise tickets months in advance.,Travel
56,The museum entry ticket was included in our tour package.,Travel
57,His boarding pass was scanned at the gate.,Travel
58,The ticket counter was crowded with travelers.,Travel
59,I need to print my train ticket before boarding.
60,Can you check the ticket prices for the London show?,Travel
61,The airline issued a refund for my canceled flight ticket.,Travel
62,We reserved our tickets for the amusement park online.,Travel
63,Her bus ticket expired before she could use it.,Travel
64,The movie ticket came with a free popcorn voucher.,Travel
65,Our tickets to the theater were front row seats.,Travel
66,He booked a one-way ticket to Tokyo.,Travel
67,The concert tickets sold out within minutes.,Travel
68,She received an e-ticket for her flight to Rome.,Travel
69,We need to confirm our ticket reservations for the ferry.,Travel
70,The ticket machine at the station was out of order.,Travel
71,They offer discounts on train tickets for students.,Travel
72,His parking ticket was invalidated by the attendant.,Travel
73,The tour guide collected all the entry tickets.,Travel
74,We upgraded our plane tickets to first class.,Travel
75,She won a free ticket to the football match.,Travel
76,The travel agent handled all our ticket bookings.,Travel
77,I forgot my ticket at home and had to buy a new one.,Travel
78,Our bus tickets were valid for the entire day.,Travel
79,The ticket clerk was very helpful with our inquiries.,Travel
80,He showed his ticket to the conductor on the train.,Travel
81,We received a digital ticket via email for the event.,Travel
82,The flight attendant checked our boarding passes.,Travel
83,We purchased round-trip tickets to the island.,Travel
84,Her theater ticket included a backstage tour.,Travel
85,They waited in line to buy tickets for the concert.,Travel
86,The ticket price for the museum was quite high.,Travel
87,He bought an express train ticket to save time.,Travel
88,She misplaced her ticket and had to request a new one.,Travel
89,We need to download our e-tickets before the trip.,Travel
90,The ticket inspector asked for our passes.,Travel
91,He exchanged his ticket for an earlier flight.,Travel
92,The bus driver accepted our digital tickets.,Travel
93,We bought tickets for the city tour online.,Travel
94,Her plane ticket allowed for one free checked bag.,Travel
95,They received complimentary tickets to the gala.,Travel
96,The ticket office opened early to accommodate travelers.,Travel
97,We used a mobile app to purchase our train tickets.,Travel
98,His concert ticket was a birthday gift from friends.,Travel
99,The conference room is booked for the entire afternoon.,Office & Work
100,Please submit your expense reports by Friday.,Office & Work
101,The printer on the third floor is out of toner.,Office & Work
102,We have a team meeting scheduled for 10 AM.,Office & Work
103,Can you send me the latest version of the report?,Office & Work
104,The office kitchen is closed for cleaning.,Office & Work
105,Please remember to log out of your computer when you leave.,Office & Work
106,The elevator is under maintenance today.,Office & Work
107,The CEO will be visiting our office next week.
108,Don't forget to attend the HR training session.,Office & Work
109,The Wi-Fi network is down in the east wing.,Office & Work
110,We need to restock the office supplies cabinet.,Office & Work
111,The project deadline has been extended by two weeks.,Office & Work
112,Please keep the noise level down in the open office area.,Office & Work
113,The new intern will start on Monday.,Office & Work
114,The air conditioning in the conference room is not working.,Office & Work
115,Remember to wear your ID badge at all times.,Office & Work
116,We need to schedule a meeting with the client.,Office & Work
117,The coffee machine is out of order.,Office & Work
118,The office will be closed on public holidays.,Office & Work
119,Can you provide feedback on the draft proposal?,Office & Work
120,The break room refrigerator will be cleaned out on Friday.,Office & Work
121,The fire drill is scheduled for next Thursday.,Office & Work
122,Please use the recycling bins for paper waste.,Office & Work
123,The project manager will review the progress tomorrow.,Office & Work
124,We have a new software update to install.,Office & Work
125,The office party will be held in the cafeteria.,Office & Work
126,The IT department will conduct system maintenance tonight.,Office & Work
127,The security team will perform an audit next week.,Office & Work
128,The reception desk needs coverage during lunch hours.,Office & Work
129,The office layout will be reconfigured next month.,Office & Work
130,Please complete the mandatory online training.,Office & Work
131,The kitchen needs more coffee filters.,Office & Work
132,The new hire orientation is at 9 AM.,Office & Work
133,The office lights are set to energy-saving mode.,Office & Work
134,The cleaning crew will arrive after hours.,Office & Work
135,Please submit your time sheets by the end of the day.,Office & Work
136,The annual performance reviews will begin next week.,Office & Work
137,The building access code has been changed.,Office & Work
138,The office parking lot is undergoing repairs.,Office & Work
139,The team lunch is scheduled for tomorrow at noon.,Office & Work
140,The budget meeting has been rescheduled.,Office & Work
141,The office phone lines are currently down.,Office & Work
142,The customer feedback survey results are in.,Office & Work
143,The project kick-off meeting is in the main conference room.,Office & Work
144,The office gym is open from 6 AM to 8 PM.,Office & Work
145,The water cooler needs to be refilled.,Office & Work
146,The team outing is planned for next Friday.,Office & Work
147,The office mailroom is located on the first floor.,Office & Work
148,The new software licenses have been distributed.,Office & Work
149,He always looks forward to spending weekends with his loved ones.,Family and Friends
150,She values the time she spends with her close ones.,Family and Friends
151,Their gatherings are always filled with laughter and joy.,Family and Friends
152,He shares his secrets with his closest confidants.,Family and Friends
153,She loves cooking meals for her dear ones.,Family and Friends
154,They plan vacations together every summer.,Family and Friends
155,He trusts his circle more than anyone else.,Family and Friends
156,She feels at home with her childhood pals.,Family and Friends
157,Their bonds grow stronger with each passing year.,Family and Friends
158,He enjoys Sunday brunches with his buddies.,Family and Friends
159,She cherishes the memories made with her besties.,Family and Friends
160,They support each other through thick and thin.,Family and Friends
161,He can always rely on his close-knit group.,Family and Friends
162,She celebrates every achievement with her loved ones.,Family and Friends
163,Their Sunday picnics are a tradition.
164,He finds comfort in their company.,Family and Friends
165,She enjoys movie nights with her close ones.,Family and Friends
166,They share a bond that's unbreakable.,Family and Friends
167,He looks forward to their annual reunions.,Family and Friends
168,She feels a sense of belonging with her dear ones.,Family and Friends
169,They are always there for each other.,Family and Friends
170,He enjoys game nights with his inner circle.,Family and Friends
171,She finds peace in their presence.,Family and Friends
172,They share stories and laughs over dinner.,Family and Friends
173,He loves the camaraderie of his group.,Family and Friends
174,She treasures the moments spent with her closest friends.,Family and Friends
175,Their bond is built on trust and love.,Family and Friends
176,He appreciates the support of his close ones.,Family and Friends
177,She feels happiest when surrounded by her dear ones.,Family and Friends
178,They create unforgettable memories together.,Family and Friends
179,He looks forward to their weekend get-togethers.,Family and Friends
180,She finds joy in their shared experiences.,Family and Friends
181,They are a source of strength for each other.,Family and Friends
182,He enjoys the warmth of their companionship.,Family and Friends
183,She loves the adventures they embark on together.,Family and Friends
184,Their friendship is a treasure she holds dear.,Family and Friends
185,He finds solace in their gatherings.,Family and Friends
186,She loves the comfort of their familiarity.,Family and Friends
187,They support each other's dreams and goals.,Family and Friends
188,He values the wisdom of his close ones.,Family and Friends
189,She feels connected to them on a deep level.,Family and Friends
190,They bring out the best in each other.,Family and Friends
191,He enjoys the simplicity of their time together.,Family and Friends
192,She finds inspiration in their stories.,Family and Friends
193,Their laughter is the best medicine for him.,Family and Friends
194,He cherishes the late-night talks with his friends.,Family and Friends
195,She feels understood by her closest confidants.,Family and Friends
196,They make every celebration special.,Family and Friends
197,He treasures the bond they share.,Family and Friends
198,She loves the unconditional support they offer.,Family and Friends
199,Discover the new standard in luxury.,Advertisement & Promos
200,Limited-time offer – act now!,Advertisement & Promos
201,Unbeatable prices for a limited time only.,Advertisement & Promos
202,Don't miss out on this exclusive deal.,Advertisement & Promos
203,Introducing the next generation of innovation.,Advertisement & Promos
204,Experience the difference with our latest technology.,Advertisement & Promos
205,Save big during our summer sale event.,Advertisement & Promos
206,Transform your space with our stylish designs.,Advertisement & Promos
207,Get more for less with our bundle deals.,Advertisement & Promos
208,Unlock savings with our loyalty program.,Advertisement & Promos
209,Join thousands of satisfied customers today.,Advertisement & Promos
210,Upgrade your lifestyle with our premium selection.,Advertisement & Promos
211,Shop smart with our easy financing options.,Advertisement & Promos
212,Discover the secret to healthier living.,Advertisement & Promos
213,Elevate your home entertainment experience.,Advertisement & Promos
214,Find your perfect match with our personalized recommendations.,Advertisement & Promos
215,Embrace the future of skincare.,Advertisement & Promos
216,Revolutionize your morning routine.,Advertisement & Promos
217,Treat yourself to luxury without the luxury price.,Advertisement & Promos
218,Enhance your productivity with our advanced tools.,Advertisement & Promos
219,Celebrate every moment with our exquisite collections.,Advertisement & Promos
220,Discover the beauty of simplicity.,Advertisement & Promos
221,Step into a world of endless possibilities.,Advertisement & Promos
222,Unleash your creativity with our innovative products.,Advertisement & Promos
223,Make a statement with our exclusive designs.,Advertisement & Promos
224,Start your journey to a healthier you today.,Advertisement & Promos
225,Redefine comfort with our ergonomic solutions.,Advertisement & Promos
226,Explore our wide range of flavors and indulge yourself.,Advertisement & Promos
227,Elevate your dining experience with our gourmet selection.,Advertisement & Promos
228,Experience the power of natural ingredients.,Advertisement & Promos
229,Discover the secret to radiant skin.,Advertisement & Promos
230,Find the perfect gift for any occasion.,Advertisement & Promos
231,Join the revolution in sustainable fashion.,Advertisement & Promos
232,Treat yourself to the ultimate relaxation experience.,Advertisement & Promos
233,Say goodbye to compromise with our premium quality.
234,Create memories that last a lifetime.,Advertisement & Promos
235,Fall in love with our timeless classics.,Advertisement & Promos
236,Upgrade your wardrobe with our latest trends.,Advertisement & Promos
237,Unlock the secret to youthful-looking skin.,Advertisement & Promos
238,Discover the art of outdoor living.,Advertisement & Promos
239,Transform your home into a sanctuary.,Advertisement & Promos
240,Experience the joy of effortless shopping.,Advertisement & Promos
241,Join our community of passionate enthusiasts.,Advertisement & Promos
242,Discover the thrill of adventure.,Advertisement & Promos
243,Enjoy peace of mind with our reliable service.,Advertisement & Promos
244,Discover why millions trust our brand.,Advertisement & Promos
245,Indulge in luxury without the luxury price tag.,Advertisement & Promos
246,Find your perfect fit with our size guide.,Advertisement & Promos
247,Elevate your workout with our performance gear.,Advertisement & Promos
248,Join us in celebrating our anniversary with special offers.,Advertisement & Promos
